{
  "age_ms": 17999991,
  "assignee": null,
  "band": "high",
  "claimed_at": null,
  "created_at": 1792288923009,
  "decided_at": null,
  "decided_by": null,
  "item_id": "rq_68ac4c93dd32b2b3e7f41ee3",
  "kind": "ioc_publication",
  "note": "",
  "priority": 310,
  "score": 100,
  "sla_breached": false,
  "sla_due_at": 1792461723009,
  "sla_hours": 48,
  "snoozed_until": null,
  "status": "open",
  "subject": {
    "ioc_id": "ioc_2a326d8ccdd822cfbc1adc2c"
  },
  "tenant_id": "t1",
  "title": "Release url indicator hxxp://stage2[.]example[.]invalid/m.sh after the public delay",
  "version": 0,
  "wording": "we assess as"
}
