{
  "age_ms": 18000000,
  "assignee": null,
  "band": "high",
  "claimed_at": null,
  "created_at": 1792288923000,
  "decided_at": null,
  "decided_by": null,
  "item_id": "rq_15a38fb1dc8c423af7110a00",
  "kind": "cve_link",
  "note": "",
  "priority": 418,
  "score": 98,
  "sla_breached": false,
  "sla_due_at": 1792375323000,
  "sla_hours": 24,
  "snoozed_until": null,
  "status": "open",
  "subject": {
    "attempt_id": "att_0e2effa1697050a0be41765f",
    "target": "FOILED-DEMO-0001"
  },
  "tenant_id": "t1",
  "title": "We assess as an attempt against FOILED-DEMO-0001 on foiled/demo-app/1.0.0 from 192.0.2.10",
  "version": 0,
  "wording": "we assess as"
}
